id,description,theme,genre
1021238,"The first part tells the story of Moses leading the Jews from Egypt to the Promised Land, his receipt of the tablets and the worship of the golden calf. The second part shows the efficacy of the commandments in modern life through a story set in San Francisco. Two brothers, rivals for the love of Mary, also come into conflict when John discovers Dan used shoddy materials to construct a cathedral.","Faith and religion|Faith and spiritual journeys|Religious faith, sin, and forgiveness",Fantasy|Drama
1013470,"After a publisher changes a writer's debut novel about a deadly assassin from fiction to nonfiction, the author finds himself thrust into the world of his lead character, and must take on the role of his character for his own survival.","Crude humor and satire|Action comedy and silly heroics|Gags, jokes, and slapstick humor|Explosive and action-packed heroes vs. villains|Funny jokes and crude humor|Amusing jokes and witty satire",Action|Comedy
1053667,"In the fishing village of Cedar Bay, terror lies within the water. And now it has surfaced in search of something more substantial to devour than marine life: human flesh. A captain and a sea biologist must wage a terrifying battle against the deadly creatures in order to save mankind from total extinction.","Horror, the undead and monster classics|Sci-fi horror, creatures, and aliens|Sci-fi monster and dinosaur adventures|Bloody vampire horror",Thriller|Horror|TV Movie|Science Fiction|Action
1039228,"Nora Helmer has years earlier committed a forgery in order to save the life of her authoritarian husband Torvald. Now she is being blackmailed, and lives in fear of her husband finding out, and of the shame such a revelation would bring to his career. But, when the truth comes out, Nora is shocked to learn where she really stands in her husband's esteem.",Moving relationship stories|Enduring stories of family and marital drama|Passion and romance,Drama
1047913,"A crazed Vietnam vet bomber hijacks a Boeing 707 in this disaster film filled with the usual early '70s stereotypes, and demands to be taken to Russia.",High speed and special ops|Air pilot heroism and survival,Action|Thriller|Drama
1001061,"Buddy is a young boy on the cusp of adolescence, whose life is filled with familial love, childhood hijinks, and a blossoming romance. Yet, with his beloved hometown caught up in increasing turmoil, his family faces a momentous choice: hope the conflict will pass or leave everything they know behind for a new life.",Moving relationship stories|Emotional and touching family dramas|Touching and sentimental family stories|Heartbreaking and moving family drama|Powerful stories of heartbreak and suffering|Quirky and endearing relationships,Drama|History
1027755,"Superman, Batman, Wonder Woman, Flash, Cyborg, Green Lantern and Vixen are transported to the strange world of Remnant and find themselves turned into teenagers. Meanwhile, Remnant heroes Ruby, Weiss, Blake and Yang must combine forces with the Justice League to uncover why their planet has been mysteriously altered before a superpowered Grimm destroys everything.",Epic heroes|Superheroes in action-packed battles with villains,Animation|Action|Fantasy
1140186,"Silhouette is the story of Jack and Amanda Harms who, after the passing of their young daughter, set out into seclusion to begin their lives anew. Quickly upon their arrival, things go awry when the sins of their past come back to haunt them.","Horror, the undead and monster classics|Intense violence and sexual transgression|Twisted dark psychological thriller|Terrifying, haunted, and supernatural horror|Gothic and eerie haunting horror|Gory, gruesome, and slasher horror|Powerful stories of heartbreak and suffering",Thriller|Drama|Horror
1011104,"An axe murderer terrorizes a small Northern California mountain community, while two young computer-obsessed adults attempt to solve the killings.","Horror, the undead and monster classics|Thrillers and murder mysteries|Intense violence and sexual transgression|Gory, gruesome, and slasher horror|Twisted dark psychological thriller|Suspenseful crime thrillers|Intriguing and suspenseful murder mysteries|Gothic and eerie haunting horror",Mystery|Horror
1000284,"The true story of pianist Władysław Szpilman's experiences in Warsaw during the Nazi occupation. When the Jews of the city find themselves forced into a ghetto, Szpilman finds work playing in a café; and when his family is deported in 1942, he stays behind, works for a while as a laborer, and eventually goes into hiding in the ruins of the war-torn city.",War and historical adventure|Humanity and the world around us|Moving relationship stories|Nazis and World War II|Powerful stories of heartbreak and suffering|Powerful poetic and passionate drama|Military combat and heroic soldiers|Surreal and thought-provoking visions of life and death,Drama|War
1017758,"Luther Heggs, a typesetter for the town newspaper, pitches an idea for a story about a local haunted house where a famous murder/suicide occurred 20 years earlier. After the editor assigns Luther to spend one night alone in the mansion, Heggs has a number of supernatural encounters and writes a front page story that makes him a hometown hero...until the nephew of the deceased sues him for libel.","Crude humor and satire|Spooky, scary comedy|Gags, jokes, and slapstick humor|Funny jokes and crude humor|Terrifying, haunted, and supernatural horror|Kids' animated fun and adventure",Romance|Comedy|Family|Mystery
1004058,"Well-off ad man Ned Merrill is visiting a friend when he notices the abundance of backyard pools that populate their upscale suburb. Ned suddenly decides that he'd like to travel the eight miles back to his own home by simply swimming across every pool in town. Soon, Ned's journey becomes harrowing; at each house, he is somehow confronted with a reminder of his romantic, domestic and economic failures.","Intense violence and sexual transgression|Humanity and the world around us|Moving relationship stories|Powerful stories of heartbreak and suffering|Dreamlike, quirky, and surreal storytelling|Surreal and thought-provoking visions of life and death|Touching and sentimental family stories|Enduring stories of family and marital drama",Drama
1025452,"On Christmas Eve, a fighter pilot on his way home gets lost mid-flight over water and needs a miracle to land safely.",War and historical adventure|Bravery in War|Air pilot heroism and survival,Drama|Fantasy|Action
1018460,A TV producer discovers a secret supernatural world as she becomes entangled with a former deity who's spent centuries searching for his lost lover.,Moving relationship stories|Captivating relationships and charming romance,Comedy|Mystery|Drama
1030411,"In the near future on a colony of state-of-the-art robots, a private investigator is hired by the colony's creator to bring his missing daughter home.","Monsters, aliens, sci-fi and the apocalypse|Thought-provoking sci-fi action and future technology|Intriguing and suspenseful murder mysteries|Suspenseful crime thrillers|Twisted dark psychological thriller",Mystery|Science Fiction|Thriller
1062577,"In the year of 754 AD, during a time of epic battles and bloodshed, the legend of the pagan warrior king, Rebad, is born, but so is a new weapon against his people: Christianity. Redbad must ultimately unite a Viking army powerful enough to defeat the seemingly invincible Franks.","Epic history and literature|Epic heroes|Historical battles and epic heroism|Fantasy adventure, heroism, and swordplay|Faith and spiritual journeys|Military combat and heroic soldiers",Drama|War|Adventure|History
1078405,"While on an afternoon walk with their children, two small town reporters notice the military camped on a hilltop. Debating the possible significance of this activity, they answer their door when two unusual strangers come knocking and find themselves held hostage in their own home.","Monsters, aliens, sci-fi and the apocalypse|Twisted dark psychological thriller|Sci-fi horror, creatures, and aliens",Horror
1085000,A school psychologist investigates the death of a student's mother and finds the boy believes he is the son of an alien being.,"Horror, the undead and monster classics|Twisted dark psychological thriller|Sci-fi horror, creatures, and aliens|Terrifying, haunted, and supernatural horror|Chilling experiments and classic monster horror|Gory, gruesome, and slasher horror",Horror|Science Fiction
1003461,A group of students on a graduation cruise bound for Manhattan soon realize they've got a stowaway aboard the ship: serial killer Jason Voorhees.,"Horror, the undead and monster classics|Gory, gruesome, and slasher horror|Sci-fi horror, creatures, and aliens|Survival horror and zombie carnage|Terrifying, haunted, and supernatural horror|Creepy, chilling, and terrifying horror",Horror|Thriller
1039049,"Yoon Song Ah works as a marketer for a cosmetics brand. She enjoys her job and dreams of launching her own brand someday. Chae Hyun Seung is a fellow marketer who becomes attracted to Yoon Song Ah. He tries to develop a romantic relationship but Yoon Song Ah rebuffs his advances, not wishing to date younger men.",Moving relationship stories|Captivating relationships and charming romance|Charming romances and delightful chemistry|Passion and romance|Touching and sentimental family stories|Tragic sadness and captivating beauty,Drama
1023942,Two bumbling service station attendants are left as the sole beneficiaries in a gangster's will. Their trip to claim their fortune is sidetracked when they are stranded in a haunted house along with several other strangers.,"Crude humor and satire|Song and dance|Spooky, scary comedy|Catchy songs and hilarious musical comedy|Gags, jokes, and slapstick humor|Terrifying, haunted, and supernatural horror|Creepy, chilling, and terrifying horror",Horror|Comedy
1015729,"Fired from his job, a former executive turns to impregnating wealthy lesbians for profit.",Humanity and the world around us|Emotional LGBTQ relationships|Erotic relationships and desire|Emotional teen coming-of-age stories,Drama|Comedy
1013088,"The spirit of a comatose teenage girl possesses the body of a newcomer to her girls' boarding school in order to enact bloody revenge against the elitist, lingerie-clad coeds responsible for her condition.","Horror, the undead and monster classics|Gory, gruesome, and slasher horror|Gothic and eerie haunting horror|Survival horror and zombie carnage|Terrifying, haunted, and supernatural horror|Extreme gory horror and cannibalism",Horror
1042352,"A boy declares his love for his girlfriend, only to die the same night. He is brought back to life by his mother as a flesh-craving zombie, who sires more teen undead while trying to control his, er, appetite for his beloved.","Crude humor and satire|Survival horror and zombie carnage|Teen school antics and laughter|Funny jokes and crude humor|Quirky and endearing relationships|Spooky, scary comedy",Horror|Comedy
1003944,"In this deceptively simple, nearly wordless tale, a young boy discovers a stray balloon, which seems to have a mind of its own, on the streets of Paris. The two become inseparable, yet the world’s harsh realities finally interfere. With its glorious palette and allegorical purity, this Academy Award-winning short film has enchanted young and old for generations.",Humanity and the world around us|Student coming-of-age challenges|Captivating relationships and charming romance|Fairy-tale fantasy and enchanted magic|Touching and sentimental family stories|Holiday joy and heartwarming Christmas,Comedy|Family|Drama|Fantasy
1030796,"Champak Chaturvedi runs a theatrical troupe in India. He hires two men, Bunty - a graduate in Arts, and Babla- who cannot read nor write English. One has to play the role of the play's hero, while one the villain. Both men end up squabbling with each other, as both want the hero's part. Then Champak finds out that Bunty has molested the play's heroine, Anjali, and punishes him. The group gets a contract to stage 30 plays in Britain, however, on the day of the departure, Anjali opts out, leaving Champak no alternative but to travel without a heroine, but hoping to recruit one while in Britain. Upon arrival, Babla sets about to find a suitable heroine from the Indian population, but Bunty beats him to it and recruits a woman named Munni.","Crude humor and satire|Gags, jokes, and slapstick humor|Amusing jokes and witty satire",Thriller|Romance|Comedy
1002318,"Set in France in 1889, the film follows the life of Dodin Bouffant as a chef living with his personal cook and lover Eugénie. They share a long history of gastronomy and love but Eugénie refuses to marry Dodin, so the food lover decides to do something he has never done before: cook for her.",Moving relationship stories|Captivating relationships and charming romance|Charming romances and delightful chemistry|Passion and romance|Touching and sentimental family stories,Romance|Drama
1155981,"Separated across continents, petro-chemist Andy Yeats and his family must survive the deadly effects of a sudden global oil crisis and find the mastermind behind it all.","Monsters, aliens, sci-fi and the apocalypse|Dangerous technology and the apocalypse|Explosive and action-packed heroes vs. villains|Humanity's odyssey: earth and beyond|Thought-provoking sci-fi action and future technology",Drama
1037171,"Disowned by his father as a boy, Surya is taken in by a crime boss. When his brother Shiv is wrongly imprisoned, his father pleads for Surya's help.",Song and dance|Bollywood emotional dramas|Adrenaline-fueled action and fast cars|Action comedy and silly heroics,Comedy|Drama|Action
1029762,"A husband and wife reevaluate their marriage after their closest friends, another couple decide to split up after twelve years.",Moving relationship stories|Passion and romance|Touching and sentimental family stories|Enduring stories of family and marital drama|Charming romances and delightful chemistry,Comedy|Drama
1003785,"A young woman witnesses a bus accident, and is caught up in the aftermath, where the question of whether or not it was intentional affects many people's lives.",Moving relationship stories|Underdogs and coming of age|Student coming-of-age challenges|Emotional teen coming-of-age stories|Powerful stories of heartbreak and suffering|Enduring stories of family and marital drama|Emotional and touching family dramas,Drama
1018858,"A caucasian prospective grad student's affluent family won't pay his way through law school, so he takes tanning pills to darken his skin in order to qualify for an African-American scholarship at Harvard. He soon gets more than he bargained for, as he begins to learn what life is really like for blacks in America.","Underdogs and coming of age|Relationship comedy|Crude humor and satire|Teen school antics and laughter|Laugh-out-loud relationship entanglements|Gags, jokes, and slapstick humor|Quirky and endearing relationships|Amusing jokes and witty satire",Comedy
1014581,"Onoff is a famous writer, now a recluse. The Inspector is suspicious when Onoff is brought into the station one night, disoriented and suffering a kind of amnesia. In an isolated, rural police station, the Inspector tries to establish the events surrounding a killing, to reach a startling resolution.",Thrillers and murder mysteries|Intriguing and suspenseful murder mysteries|Suspenseful crime thrillers|Noir and dark crime dramas,Mystery|Drama|Thriller|Crime
1037681,"An epic tale of a changing Britain over four decades, seen through the eyes of four friends.",Politics and human rights|Lavish dramas and sumptuous royalty,Drama
1019737,"Nicholas Nickleby, a young boy in search of a better life, struggles to save his family and friends from the abusive exploitation of his coldheartedly grasping uncle.",Moving relationship stories|Touching and sentimental family stories|Emotional and touching family dramas|Powerful stories of heartbreak and suffering|Enduring stories of family and marital drama|Heartbreaking and moving family drama,Drama|Adventure
1005790,"In response to a global rise in demonic possessions, the Catholic Church reopens exorcism schools to train priests in the Rite of Exorcism. On this spiritual battlefield, an unlikely warrior rises: a young nun, Sister Ann. Thrust onto the spiritual frontline with fellow student Father Dante, Sister Ann finds herself in a battle for the soul of a young girl and soon realizes the Devil has her right where he wants her.","Horror, the undead and monster classics|Terrifying, haunted, and supernatural horror|Religious faith, sin, and forgiveness|Twisted dark psychological thriller|Creepy, chilling, and terrifying horror",Thriller|Horror
1076930,"A pair of bodyguards for a politician find their positions under threat when their employer is implicated in a scandal. Fleeing to Mumbai they find work with a gangster, but also find that the police are onto them.",Song and dance|Bollywood emotional dramas,Comedy|Crime|Action
1046597,"A young couple traveling through the Pyrenees stays overnight at an ancient Spanish castle, only to discover that it is the headquarters for a coven of witches.","Horror, the undead and monster classics|Gothic and eerie haunting horror|Terrifying, haunted, and supernatural horror|Creepy, chilling, and terrifying horror|Gory, gruesome, and slasher horror",Horror|Mystery
1011044,"A case of the flu quickly morphs into a pandemic. As the death toll mounts and the living panic, the government plans extreme measures to contain it.",High speed and special ops|Dangerous technology and the apocalypse,Adventure|Science Fiction|Action
1001764,"Katia and Maurice Krafft loved two things — each other, and volcanoes. For two decades, the daring French volcanologist couple were seduced by the thrill and danger of this elemental love triangle. They roamed the planet, chasing eruptions and their aftermath, documenting their discoveries in stunning photographs and breathtaking film to share with an increasingly curious public in media appearances and lecture tours. Ultimately, Katia and Maurice would lose their lives during a 1991 volcanic explosion on Japan’s Mount Unzen, but they would leave a legacy that would forever enrich our knowledge of the natural world.",Moving relationship stories|Humanity's odyssey: earth and beyond|Passion and romance|Captivating relationships and charming romance,Documentary
1182053,"An old Panamanian holiday tradition personified as a homeless man disrupts the life of a workaholic animal rescuer to show him the true meaning of love, friendship and family.",Moving relationship stories|Captivating relationships and charming romance|Touching and sentimental family stories|Emotional LGBTQ relationships,Romance
1006269,A US Fighter pilot's epic struggle of survival after being shot down on a mission over Laos during the Vietnam War.,"War and historical adventure|Bravery in War|Military combat and heroic soldiers|Air pilot heroism and survival|Political drama, patriotism, and war|Brutal, violent prison drama",Drama|Adventure|War
1013004,"France, on the eve of the French Revolution. Henriette and Louise have been raised together as sisters. When the plague that takes their parents' lives causes Louise's blindness, they decide to travel to Paris in search of a cure, but they separate when a lustful aristocrat crosses their path.","Epic history and literature|Politics and human rights|Lavish dramas and sumptuous royalty|Enduring stories of family and marital drama|Political drama, patriotism, and war|Riveting political and presidential drama|Heartbreaking and moving family drama",Drama|History|Romance
1046251,"A sex worker, a hired killer, and a movie crew cross paths in a Venice hotel where human meat is on the menu.","Intense violence and sexual transgression|Dreamlike, quirky, and surreal storytelling",Comedy
1032630,The happy tranquility of Bugville is shattered when the populace learns that a colossal skyscraper is to be built over their tiny town.,Holiday joy and heartwarming Christmas|Fairy-tale fantasy and enchanted magic|Dazzling vocal performances and musicals|Adorable animals and heartwarming families|Kids' animated fun and adventure,Comedy|Family|Animation
1044793,"At the turn of the 20th century, young Asa Yoelson decides to go against the wishes of his cantor father and pursue a career in show business. Gradually working his way up through the vaudeville ranks, Asa — now calling himself Al Jolson — joins a blackface minstrel troupe and soon builds a reputation as a consummate performer. But as his career grows in size, so does his ego, resulting in battles in business as well as in his personal life.",Song and dance|Dazzling vocal performances and musicals|Legendary musicians and stardom|Emotional life of renowned artists|Dance rhythms and catchy tunes,Music|Drama
1042521,"By God's order, Abraham was commanded to sacrifice his son Isaac on the mountain of Moriah. While traveling to the place of the sacrifice, alongside Isaac and two servants, Abraham is flooded with vivid memories from the years he and Sarah spent longing for the son they were promised—the son he must now lay upon the altar.","Faith and religion|Religious faith, sin, and forgiveness|Faith and spiritual journeys|Touching and sentimental family stories",Fantasy|Drama
1027011,The film follows a man with an unwanted gift for healing who meets a teenager with cancer who helps him to find himself.,Faith and religion|Touching and sentimental family stories,Family|Drama|Comedy
1002642,"Wealthy and precocious teenager Juliet transfers from England to New Zealand with her family, and soon befriends the quiet, brooding Pauline through their shared love of fantasy and literature. When their parents begin to suspect that their increasingly intense and obsessive bond is becoming unhealthy, the girls hatch a dark plan for those who threaten to keep them apart.","Intense violence and sexual transgression|Moving relationship stories|Humanity and the world around us|Emotional teen coming-of-age stories|Gripping, intense violent crime|Powerful stories of heartbreak and suffering|Challenging or sexual themes & twists|Emotional LGBTQ relationships",Drama|Fantasy
1014194,"The recently widowed mother of two, Sarah, is desperate to know who murdered her husband in front of her young son, rendering him mute. Coerced into helping a low-life drug dealer stash narcotics stolen from the local Mr. Big, she's forced into taking drastic action to protect her children, evolving from downtrodden submissive to take-charge vigilante.","Crime, drugs and gangsters|Gritty crime and ruthless gangsters|Twisted dark psychological thriller|Violent crime and drugs|Graphic violence and brutal revenge|Suspenseful crime thrillers",Crime|Thriller
1015028,"With a team of the world's foremost historic and marine experts as well as friend Bill Paxton, James Cameron embarks on an unscripted adventure back to the wreck of the Titanic where nearly 1,500 souls lost their lives almost a century ago.",Epic history and literature|Disastrous voyages and heroic survival|Humanity's odyssey: earth and beyond,Documentary
1032941,"Deprived of a normal childhood by her ambitious mother, Lillian Roth becomes a star of Broadway and Hollywood before she is twenty. Shortly before her marriage to her childhood sweetheart, David Tredman, he dies and Lillian takes her first drink of many down the road of becoming an alcoholic.",Song and dance|Emotional life of renowned artists|Powerful stories of heartbreak and suffering|Dazzling vocal performances and musicals|Enduring stories of family and marital drama|Heartbreaking and moving family drama,Drama
1009554,"In the wake of King Edward's death, Uhtred of Bebbanburg and his comrades adventure across a fractured kingdom in the hopes of uniting England at last.","Epic history and literature|Epic heroes|Historical battles and epic heroism|Fantasy adventure, heroism, and swordplay|Lavish dramas and sumptuous royalty|Captivating vision and Shakespearean drama",Action|War|Adventure
1000200,"When Tony Stark tries to jumpstart a dormant peacekeeping program, things go awry and Earth’s Mightiest Heroes are put to the ultimate test as the fate of the planet hangs in the balance. As the villainous Ultron emerges, it is up to The Avengers to stop him from enacting his terrible plans, and soon uneasy alliances and unexpected action pave the way for an epic and unique global adventure.","Epic heroes|High speed and special ops|Superheroes in action-packed battles with villains|Thought-provoking sci-fi action and future technology|Action-packed space and alien sagas|Action comedy and silly heroics|Fantasy adventure, heroism, and swordplay",Action|Adventure|Science Fiction
1018798,A young man with a vendetta against a business tycoon seduces and kills his eldest daughter and then proceeds to his younger daughter but she begins to suspect her new lover's ulterior motive.,"Intense violence and sexual transgression|Bollywood emotional dramas|Gripping, intense violent crime|Twisted dark psychological thriller",Thriller|Crime
1004514,"A pampered Beverly Hills chihuahua named Chloe who, while on vacation in Mexico with her owner Viv's niece, Rachel, gets lost and must rely on her friends to help her get back home before she is caught by a dognapper who wants to ransom her.","Crude humor and satire|Adorable animals and heartwarming families|Kids' animated fun and adventure|Fairy-tale fantasy and enchanted magic|Funny jokes and crude humor|Gags, jokes, and slapstick humor",Family|Comedy|Romance|Adventure
