id,description,theme,genre
1038492,"A physician on death row for a mercy killing is allowed to experiment on a serum using a criminals' blood, but secretly tests it on himself. He gets a pardon, but finds out he's become a Jekyll-&-Hyde.","Thrillers and murder mysteries|Chilling experiments and classic monster horror|Suspenseful crime thrillers|Creepy, chilling, and terrifying horror|Intriguing and suspenseful murder mysteries|Gory, gruesome, and slasher horror",Science Fiction|Crime|Horror
1122056,"The movie covers the careers of five up-and-coming horror-movie loving directors – Mark Borchardt ('Coven'), Ron Atkins ('Necromaniac'), Dave Stagnari ('Catharsis'), John Gora ('Chirpy'), and Brian Singleton.","Monsters, aliens, sci-fi and the apocalypse|Fascinating, emotional stories and documentaries",Documentary|Horror
1023549,"Set in the early 1900s in the fictional Catfish Row section of Charleston, South Carolina, which serves as home to a black fishing community, the story focuses on the titular characters, crippled beggar Porgy, who travels about in a goat-drawn cart, and the drug-addicted Bess, who lives with stevedore Crown, the local bully.",Song and dance|Dazzling vocal performances and musicals|Legendary musicians and stardom|Emotional life of renowned artists,Music|Drama|Romance
1003429,"An immature, newly unemployed comic must navigate the murky waters of adulthood after her fling with a graduate student results in an unplanned pregnancy.","Relationship comedy|Crude humor and satire|Moving relationship stories|Laugh-out-loud relationship entanglements|Funny jokes and crude humor|Quirky and endearing relationships|Teen school antics and laughter|Gags, jokes, and slapstick humor",Comedy|Romance
1002179,"Three moments in Takaki's life: his relationship with Akari and their forced separation; his friendship with Kanae, who is secretly in love with him; the demands and disappointments of adulthood, an unhappy life in a cold city.",Moving relationship stories|Emotional teen coming-of-age stories|Powerful stories of heartbreak and suffering|Captivating relationships and charming romance|Touching and sentimental family stories|Tragic sadness and captivating beauty,Animation|Drama|Romance
1016367,A small but brave donkey and his animal friends become the unsung heroes of the greatest story ever told: the first Christmas.,Faith and religion|Kids' animated fun and adventure|Holiday joy and heartwarming Christmas|Adorable animals and heartwarming families|Fairy-tale fantasy and enchanted magic|Faith and spiritual journeys,Family|Fantasy|Adventure|Comedy|Animation
1016901,"The story of Dulce, a mother who has encounters with apparitions inside her old house. She must decipher a mystery that could trigger a prophecy: the death of her family.","Thrillers and murder mysteries|Terrifying, haunted, and supernatural horror|Twisted dark psychological thriller|Gothic and eerie haunting horror|Suspenseful crime thrillers|Noir and dark crime dramas",Drama|Horror|Fantasy
1029660,"After a night of drunken exploits, Allison, Harris, and Kira are chased and terrorized by the ghosts of a child pyromaniac, an ax murderer, and a rapist.","Horror, the undead and monster classics|Terrifying, haunted, and supernatural horror|Gory, gruesome, and slasher horror|Creepy, chilling, and terrifying horror|Gothic and eerie haunting horror|Sci-fi horror, creatures, and aliens",Horror|Thriller
1032674,"Financially troubled, a newbie hitman reluctantly takes the job of finding the plotted killer of a Japanese tycoon.","Epic heroes|Intense combat and martial arts|Violent action, guns, and crime|Action comedy and silly heroics|Gags, jokes, and slapstick humor|Explosive and action-packed heroes vs. villains",Comedy|Thriller|Action
1037271,"An English nurse and an American soldier on the Italian front during World War I fall in love, but the horrors surrounding them test their romance to the limit.",War and historical adventure|Military combat and heroic soldiers|Nazis and World War II|Historical battles and epic heroism|Passion and romance|Bravery in War,Drama|War|Romance
1021307,Two young men — a Palestinian grad student and an Israeli lawyer — meet and fall in love amidst personal and political intrigue.,Moving relationship stories|Emotional LGBTQ relationships|Powerful stories of heartbreak and suffering|Tragic sadness and captivating beauty|Touching and sentimental family stories|Emotional teen coming-of-age stories,Thriller|Romance|Drama
1022396,"Coy ""Cannonball"" Buckman and his blazing red Pontiac enter the Trans-America Grand Prix, an underground road race spanning the continent in which there are no rules, no speed limits and no heed for the law. En route, Buckman jockeys with an international ensemble of racers for a $100,000 purse. But there are none more important than Cade Redman, his direct competition for a guaranteed spot on the elite Modern Motors racing team.",Crude humor and satire|Adrenaline-fueled action and fast cars|Action comedy and silly heroics,Comedy|Action
1028269,Two 19th-century footballers on opposite sides of a class divide navigate professional and personal turmoil to change the game — and England — forever.,Epic history and literature|Inspiring sports underdog stories,Drama
1012971,"After serving 28 years in prison for accidentally killing the son of a crime boss, newly paroled gangster Val reunites with his former partners in crime, Doc and Hirsch, for a night on the town. As the three men revisit old haunts, reflect on their glory days and try to make up for lost time, one wrestles with a terrible quandary: Doc has orders to kill Val, and time is running out for him to figure out a way out of his dilemma.","Crude humor and satire|Crime, drugs and gangsters|Relationship comedy|Gags, jokes, and slapstick humor|Quirky and endearing relationships|Violent action, guns, and crime|Funny jokes and crude humor|Gritty crime and ruthless gangsters",Comedy|Action|Thriller
1007057,"If your enemy refuses to be humbled... Destroy him. Accompanied by his brother Kurt (Van Damme), American kickboxing champion Eric Sloane (Dennis Alexio), arrives in Thailand to defeat the Eastern warriors at their own sport. His opponent: ruthless fighter and Thai champion, Tong Po. Tong not only defeats Eric, he paralyzes him for life. Crazed with anger, Kurt vows revenge.",Epic heroes|Intense combat and martial arts|Underdog fighting and boxing stories|Inspiring sports underdog stories,Thriller|Action|Drama
1037515,"Town residents must band together after a devastating alien invasion. As they struggle to survive, they realize they must stay one step ahead of their attackers and work together for a chance to strike back.","Monsters, aliens, sci-fi and the apocalypse|Action-packed space and alien sagas|Dangerous technology and the apocalypse|Imaginative space odysseys and alien encounters|Thought-provoking sci-fi action and future technology|Superheroes in action-packed battles with villains",Science Fiction|Drama|Action
1012880,"Jan Schlickmann is a cynical lawyer who goes out to 'get rid of' a case, only to find out it is potentially worth millions. The case becomes his obsession, to the extent that he is willing to give up everything—including his career and his clients' goals—in order to continue the case against all odds.",Epic heroes|Enduring stories of family and marital drama,Drama
1014394,A man's nervous breakdown causes him to leave his wife and live in his attic for several months.,Moving relationship stories|Enduring stories of family and marital drama|Heartbreaking and moving family drama|Passion and romance,Drama
1036842,"An evil Duke attempts to kill and collect the blood of a royal family of European vampires in order to become all powerful. The only surviving member of the family travels to Hong Kong, only to complicate his struggle by falling in love with a mortal girl who just happens to have a vampire hunter for a brother.","Epic heroes|Crude humor and satire|Intense combat and martial arts|Action comedy and silly heroics|Bloody vampire horror|Gags, jokes, and slapstick humor|Laugh-out-loud relationship entanglements",Comedy|Action|Horror
1004226,"Based on actual events that took place at Gwangju Inhwa School for the hearing-impaired, where young deaf students were the victims of repeated sexual assaults by faculty members over a period of five years in the early 2000s.",Intense violence and sexual transgression|Challenging or sexual themes & twists|Powerful stories of heartbreak and suffering|Graphic violence and brutal revenge|Emotional and touching family dramas|Violent crime and drugs,Drama
1011277,"An undercover police officer named Rock Keats befriends a drug dealer and car thief named Archie Moses in a bid to catch the villainous drug lord Frank Coltan. But the only problem is that Keats is a cop, his real name is Jack Carter, and he is working undercover with the LAPD to bust Moses and Colton at a sting operation the LAPD has set up.","Crude humor and satire|Gags, jokes, and slapstick humor|Heists and thrilling action|Action comedy and silly heroics|Funny jokes and crude humor|Violent action, guns, and crime",Crime|Comedy|Action
1040177,What should have been a romantic getaway turns into one hilarious debacle after another when Michael's woman dumps him in the desert where he gets carjacked by a teenager and he is taken hostage in a stickup at the local Sip and Zip.,"Crude humor and satire|Gags, jokes, and slapstick humor|Funny jokes and crude humor|Amusing jokes and witty satire|Laugh-out-loud relationship entanglements|Catchy songs and hilarious musical comedy",Comedy
1004964,"While her husband is on a business trip, Gamhee meets three of her friends on the outskirts of Seoul. They make friendly conversation, as always, but there are different currents flowing independently of each other, both above and below the surface.",Moving relationship stories|Captivating relationships and charming romance,Drama
1004876,A black ops assassin is forced to fight for her own survival after a job goes dangerously wrong.,High speed and special ops|Explosive and action-packed heroes vs. villains|Exciting spy thrillers with tense intrigue,Crime|Action|Thriller
1003593,"An immigrant worker at a pickle factory is accidentally preserved for 100 years and wakes up in modern day Brooklyn. He learns his only surviving relative is his great grandson, a computer coder who he can’t connect with.","Crude humor and satire|Relationship comedy|Amusing jokes and witty satire|Funny jokes and crude humor|Gags, jokes, and slapstick humor|Laugh-out-loud relationship entanglements|Quirky and endearing relationships",Comedy|Drama
1003589,"Young-goon, mentally deranged and frequently electro-charging herself with a transistor radio, has been admitted into a mental institution. Firmly believing herself to be a cyborg, she refuses to consume like a human being. Il-soon is another patient, who catches the eye of Young-goon and soon becomes a close friend. Il-soon is now confronted with the biggest task - to cure Young-goon’s mental problem and have her eat real food.","Humanity and the world around us|Relationship comedy|Surreal and thought-provoking visions of life and death|Dreamlike, quirky, and surreal storytelling",Romance|Drama|Comedy
1004386,"Dora, a girl who has spent most of her life exploring the jungle with her parents, now must navigate her most dangerous adventure yet: high school. Always the explorer, Dora quickly finds herself leading Boots (her best friend, a monkey), Diego, and a rag tag group of teens on an adventure to save her parents and solve the impossible mystery behind a lost Inca civilization.",Crude humor and satire|Underdogs and coming of age|Kids' animated fun and adventure|Teen school antics and laughter|Holiday joy and heartwarming Christmas|Catchy songs and hilarious musical comedy|Laugh-out-loud relationship entanglements,Comedy|Fantasy|Family|Adventure
1004043,"When a huge blizzard (that doesn't show signs of stopping) hits, Gracetown is completely snowed in. But even though it's cold outside, things are heating up inside, proving that Christmas is magical when it comes to love.",Relationship comedy|Teen school antics and laughter|Laugh-out-loud relationship entanglements|Quirky and endearing relationships|Holiday joy and heartwarming Christmas|Touching and sentimental family stories,Comedy|Romance
1027675,Cattle baron John Chisum joins forces with Billy the Kid and Pat Garrett to fight the Lincoln County Land War in the New Mexico Territory of 1878.,Westerns|Epic heroes|Wild west outlaws and gunfights|Western frontier dramas with a touch of humor|Historical battles and epic heroism,Western
1004407,"Earth is peaceful following the Tournament of Power. Realizing that the universes still hold many more strong people yet to see, Goku spends all his days training to reach even greater heights. Then one day, Goku and Vegeta are faced by a Saiyan called 'Broly' who they've never seen before. The Saiyans were supposed to have been almost completely wiped out in the destruction of Planet Vegeta, so what's this one doing on Earth? This encounter between the three Saiyans who have followed completely different destinies turns into a stupendous battle, with even Frieza (back from Hell) getting caught up in the mix.","Epic heroes|Superheroes in action-packed battles with villains|Intense combat and martial arts|Emotional and captivating fantasy storytelling|Fantasy adventure, heroism, and swordplay|Historical battles and epic heroism",Science Fiction|Animation|Action
1045768,"Welcome to Fuller Junction, Wisconsin, a friendly small town settled by Norwegian farmers.  Here we see the exploits of two young cousins, Selma and Arnold, who learn about their world and experience the ups and downs of life as the season pass.",Moving relationship stories|Emotional and touching family dramas|Touching and sentimental family stories|Heartbreaking and moving family drama|Enduring stories of family and marital drama|Powerful stories of heartbreak and suffering,Drama|Family
1041150,"Smith, a mob informer hiding out with the Witness Protection Program, decides to make a break for it and hide out in the Arizona desert. The Feds catch up with him and rescue him just before a group of hitmen can manage to silence him for good. In the course of getting Smith away from the mafia thugs, the pair of agents assigned to protect him turn onto an abandoned stretch of highway nicknamed 'Route 666' after the mysterious death of a prison chain gang. As the three continue on their way, they soon discover just what happened to the chain gang, and how the highway earned its name.","Crime, drugs and gangsters|Horror, the undead and monster classics|Violent action, guns, and crime|Heists and thrilling action|Terrifying, haunted, and supernatural horror|Brutal, violent prison drama|Survival horror and zombie carnage",Thriller|Horror|Action
1022657,An elite superhuman agent must stop a foreign military unit from seizing control of an ancient artifact that holds the key to ultimate power.,"Epic heroes|Monsters, aliens, sci-fi and the apocalypse|Superheroes in action-packed battles with villains|Explosive and action-packed heroes vs. villains|Action-packed space and alien sagas|Fantasy adventure, heroism, and swordplay|Dangerous technology and the apocalypse",Animation|Action|Science Fiction
1001255,"This simple romantic tragedy begins in 1957. Guy Foucher, a 20-year-old French auto mechanic, has fallen in love with 17-year-old Geneviève Emery, an employee in her widowed mother's chic but financially embattled umbrella shop. On the evening before Guy is to leave for a two-year tour of combat in Algeria, he and Geneviève make love. She becomes pregnant and must choose between waiting for Guy's return or accepting an offer of marriage from a wealthy diamond merchant.",Moving relationship stories|Song and dance|Captivating relationships and charming romance|Dazzling vocal performances and musicals|Charming romances and delightful chemistry|Touching and sentimental family stories|Passion and romance,Drama|Romance
1003948,"After fighting his demons for decades, John Rambo now lives in peace on his family ranch in Arizona, but his rest is interrupted when Gabriela, the granddaughter of his housekeeper María, disappears after crossing the border into Mexico to meet her biological father. Rambo, who has become a true father figure for Gabriela over the years, undertakes a desperate and dangerous journey to find her.","Epic heroes|War and historical adventure|Violent action, guns, and crime|Military combat and heroic soldiers|Graphic violence and brutal revenge|Gritty crime and ruthless gangsters|Brutal, violent prison drama",Action|Thriller|Drama
1065689,"Maxwell Slaughter is a kind, heavyset guy who has reached the rank of master sergeant in the army. Admired by handsome young Sgt. Eustis Clay, Slaughter forms a close bond with his peer. Clay hopes to convince Slaughter to join him in a business venture outside of the service, but, in the meantime, he introduces the older officer to the beautiful young Bobby Jo Pepperdine, inadvertently creating trouble for both men.",Relationship comedy|Laugh-out-loud relationship entanglements,Comedy|Drama
1060736,"Husband-and-wife scientists (Peter Graves, Andrea King) pick up a pie-in-the-sky TV message supposedly from Mars.","Faith and religion|Monsters, aliens, sci-fi and the apocalypse|Politics and human rights|Imaginative space odysseys and alien encounters|Political drama, patriotism, and war|Faith and spiritual journeys|Riveting political and presidential drama|Dangerous technology and the apocalypse",Science Fiction
1054494,"Blue-collar Paulie prepares for fatherhood and his forthcoming wedding to Sue by hanging out with his groomsmen. Brother Jimbo, cousin Mike, and his pals fill the reunion with drinking, boys-will-be-boys antics and a few unexpected personal confessions. But, when the bonding devolves into accusations and regret, Paulie has to decide whether he's ready to tie the knot and take this big step into adulthood.",Crude humor and satire|Quirky and endearing relationships,Comedy|Drama|Romance
1010191,"Academy Award-winning documentary filmmaker, Jean-Xavier de Lestrade, presents a gripping courtroom thriller, offering a rare and revealing inside look at a high-profile murder trial. In 2001, author Michael Peterson was arraigned for the murder of his wife Kathleen, whose body was discovered lying in a pool of blood on the stairway of their home. Granted unusual access to Peterson's lawyers, home and immediate family, de Lestrade's cameras capture the defense team as it considers its strategic options. The series is an engrossing look at contemporary American justice that features more twists than a legal bestseller.","Thrillers and murder mysteries|Enduring stories of family and marital drama|Suspenseful crime thrillers|Gripping, intense violent crime",Documentary|Crime
1032969,"Part drama, part documentary, The Road to Guantánamo focuses on the Tipton Three, a trio of British Muslims who were held in Guantanamo Bay for two years until they were released without charge.","War and historical adventure|Politics and human rights|Politics, propaganda, and political documentaries|Military combat and heroic soldiers|Nazis and World War II|Brutal, violent prison drama|Political drama, patriotism, and war",Drama
1005064,"In a dystopian future, Dredd, the most famous judge (a cop with instant field judiciary powers) is convicted for a crime he did not commit while his murderous counterpart escapes.","Monsters, aliens, sci-fi and the apocalypse|Crime, drugs and gangsters|Thought-provoking sci-fi action and future technology|Superheroes in action-packed battles with villains|Violent action, guns, and crime|Action comedy and silly heroics|Gritty crime and ruthless gangsters",Science Fiction
1007094,"In 1999, Star Wars fanatics take a cross-country trip to George Lucas' Skywalker Ranch so their dying friend can see a screening of The Phantom Menace before its release.","Crude humor and satire|Funny jokes and crude humor|Gags, jokes, and slapstick humor|Amusing jokes and witty satire|Teen school antics and laughter|Laugh-out-loud relationship entanglements",Adventure|Comedy
1003502,"Mitchie can't wait to go back to Camp Rock and spend the summer making new music with her friends and superstar Shane Gray. But the slick new camp across the lake, Camp Star, has drummed up some serious competition – featuring newcomers Luke and Dana. In a sensational battle of the bands, with Camp Rock's future at stake, will Camp Star's flashy production and over-the-top antics win out, or will Camp Rockers prove that music, teamwork, and spirit are what truly matter?",Song and dance|Dazzling vocal performances and musicals|Dance rhythms and catchy tunes|Catchy songs and hilarious musical comedy,Music|Comedy|TV Movie
1003460,Beneath Anna Poliatova's striking beauty lies a secret that will unleash her indelible strength and skill to become one of the world's most feared government assassins.,"High speed and special ops|Explosive and action-packed heroes vs. villains|Exciting spy thrillers with tense intrigue|Violent action, guns, and crime",Action|Thriller
1044316,"Four crooks rob a jewelery shop, then head for an abandoned factory where they plan to fence the goods to the Yakuza. Unfortunately, their chosen location happens to be the same place where American scientists had previously experimented on resurrecting the dead.",Epic heroes|Survival horror and zombie carnage|Bloody vampire horror,Horror|Science Fiction
1143293,"Taking place 25 years after the original British smash hit, the same band of brothers navigate the post-industrial city of Sheffield and society's crumbling healthcare, education, and employment sectors.","Crude humor and satire|Underdogs and coming of age|Amusing jokes and witty satire|Gags, jokes, and slapstick humor|Catchy songs and hilarious musical comedy|Quirky and endearing relationships|Laugh-out-loud relationship entanglements",Comedy|Drama
1015001,"The surface of the Earth is under attack, thousands of people are killed in this unprovoked attacked. The cause, Princess Dragonmon and her army of monsters have decided to invade. Princess Dragonmon is an alien whose race has been hiding under us for centuries waiting to attack at the time is right. A doctor has been preparing for something like this and turns his assistant Rayma into the cyborg hero known as Inframan. Now only Inframan stands between the Earth and Princess Dragonmon but when a close friend is captured and brainwashed, can she be stopped with this inside man feeding her info?",Epic heroes|Intense combat and martial arts|Sci-fi monster and dinosaur adventures|Action comedy and silly heroics|Superheroes in action-packed battles with villains|Action-packed space and alien sagas,Adventure|Action|Science Fiction
1010451,"Jed, an airline pilot, is resting in a hotel when he notices Nell, a young woman babysitting for a wealthy couple. As Jed gets to know Nell better he realises that the woman is not as stable as perhaps she should be.",Intense violence and sexual transgression|Twisted dark psychological thriller,Thriller|Drama
1132326,"Action-packed conspiracy thriller series about Sir Mark Brydon, British Ambassador to Washington, who finds himself at the centre of a terrifying conspiracy that could bring down Western governments.","Politics and human rights|Intense political and terrorist thrillers|Exciting spy thrillers with tense intrigue|Politics, propaganda, and political documentaries|Explosive and action-packed heroes vs. villains",Drama
1006783,"Former British soldier Jonathan Pine navigates the shadowy recesses of Whitehall and Washington where an unholy alliance operates between the intelligence community and the secret arms trade. To infiltrate the inner circle of lethal arms dealer Richard Onslow Roper, Pine must himself become a criminal.",High speed and special ops|Exciting spy thrillers with tense intrigue|Intense political and terrorist thrillers|Explosive and action-packed heroes vs. villains|Superheroes in action-packed battles with villains,Crime|Drama|Mystery
1001466,"Aging wrestler Randy ""The Ram"" Robinson is long past his prime but still ready and rarin' to go on the pro-wrestling circuit. After a particularly brutal beating, however, Randy hangs up his tights, pursues a serious relationship with a long-in-the-tooth stripper, and tries to reconnect with his estranged daughter. But he can't resist the lure of the ring and readies himself for a comeback.",Moving relationship stories|Underdog fighting and boxing stories|Powerful stories of heartbreak and suffering|Touching and sentimental family stories|Heartbreaking and moving family drama|Emotional teen coming-of-age stories,Drama|Romance
1016844,"As a group of seniors celebrate their final college days at a smart house, the house's highly advanced AI system, Margaux, begins to take on a deadly presence of her own. A carefree weekend of partying turns into a dystopian nightmare as they realize Margaux's plans to eliminate her tenants one way or another. Time begins to run out as the group desperately tries to survive and outsmart the smart home.","Horror, the undead and monster classics|Gory, gruesome, and slasher horror",Science Fiction|Horror
1006958,The only son of wealthy widow Violet Venable dies while on vacation with his cousin Catherine. What the girl saw was so horrible that she went insane; now Mrs. Venable wants Catherine lobotomized to cover up the truth.,"Intense violence and sexual transgression|Challenging or sexual themes & twists|Enduring stories of family and marital drama|Gripping, intense violent crime|Dreamlike, quirky, and surreal storytelling|Emotional teen coming-of-age stories",Mystery|Thriller|Drama
