id,description,theme,genre
1005896,"Thirty years after serving together in the Vietnam War, Larry ""Doc"" Shepherd, Sal Nealon and the Rev. Richard Mueller reunite for a different type of mission: to bury Doc's son, a young Marine killed in Iraq. Forgoing burial at Arlington National Cemetery, Doc and his old buddies take the casket on a bittersweet trip up the coast to New Hampshire. Along the way, the three men find themselves reminiscing and coming to terms with the shared memories of a war that continues to shape their lives.",Moving relationship stories|Military combat and heroic soldiers|Touching and sentimental family stories|Powerful stories of heartbreak and suffering|Quirky and endearing relationships,Drama|Comedy
1022739,"After the death of his wife, wealthy businessman Philip Emmenthal and his son Storey open their own private harem in their family residence in Geneva (they get the idea while watching Federico Fellini's 8½ and after Storey is ""given"" a woman, Simato (Inoh), to waive her pachinko debts). They sign one-year contracts with eight (and a half) women to this effect. The women each have a gimmick (one is a nun, another a kabuki performer, etc.). Philip soon becomes dominated by his favourite of the concubines, Palmira, who has no interest in Storey as a lover, despite what their contract might stipulate. Philip dies, the concubines' contracts expire, and Storey is left alone with Giulietta (the titular ""½"", played by Fujiwara) and of course the money and the houses.",Intense violence and sexual transgression|Challenging or sexual themes & twists|Erotic relationships and desire|Surreal and thought-provoking visions of life and death,Drama|Comedy
1029379,"Wealthy widow Mrs. Bramson notices that her maid is distracted, and when she learns the girl's fiancé, Danny, is the reason, she summons him in. Mrs. Bramson's niece Olivia takes a liking to Danny, and comes to believe that he may have been involved in the disappearance of a local woman.","Thrillers and murder mysteries|Intriguing and suspenseful murder mysteries|Suspenseful crime thrillers|Noir and dark crime dramas|Twisted dark psychological thriller|Terrifying, haunted, and supernatural horror",Thriller|Romance|Mystery
1023301,"A movie adaptation of Homer's second epic, that talks about Ulysses' efforts to return to his home after the end of ten years of war.","Epic history and literature|Historical battles and epic heroism|Fantasy adventure, heroism, and swordplay|Disastrous voyages and heroic survival|Epic adventure and breathtaking battles|Lavish dramas and sumptuous royalty",Fantasy|Adventure
1040300,The carefree life of a 40-year-old playboy comes to a standstill when he comes to know that he has a 20 something-year-old daughter.,Relationship comedy|Laugh-out-loud relationship entanglements|Touching and sentimental family stories|Quirky and endearing relationships|Charming romances and delightful chemistry,Comedy
1022652,"Five people visit a fairground sideshow run by the sinister Dr. Diabolo. Having shown them a handful of haunted-house-style attractions, he promises them a genuinely scary experience if they will pay extra.","Horror, the undead and monster classics|Creepy, chilling, and terrifying horror|Terrifying, haunted, and supernatural horror|Gothic and eerie haunting horror|Gory, gruesome, and slasher horror|Chilling experiments and classic monster horror",Horror
1059975,"Vaidehi (Manisha Koirala) gets married to Raghuvir (Jackie Shroff), an NRI. Suffering the agony of an unhappy marriage, she decides to run away from him when she learns that she is pregnant and he wants to take the child away from her. In her pursuit for freedom, she meets Mythili (Mahima Chaudhury) a bride-to-be, Janaki (Madhuri Dixit) a theatre artist and Ramdulari (Rekha) a village midwife - all of whom are victims of male chauvinism. They however refuse to be put down and fight for their rights.","Intense violence and sexual transgression|Heartbreaking and moving family drama|Bollywood emotional dramas|Gripping, intense violent crime",Drama
1029066,"Will Plunkett and Captain James Macleane, two men from different ends of the social spectrum in 18th-century England, enter a gentlemen's agreement: They decide to rid the aristocrats of their belongings. With Plunkett's criminal know-how and Macleane's social connections, they team up to be soon known as ""The Gentlemen Highwaymen"". But when one day these gentlemen hold up Lord Chief Justice Gibson's coach, Macleane instantly falls in love with his beautiful and cunning niece, Lady Rebecca Gibson. Unfortunately, Thief Taker General Chance, who also is quite fond of Rebecca, is getting closer and closer to getting both.","Relationship comedy|Crude humor and satire|Laugh-out-loud relationship entanglements|Gags, jokes, and slapstick humor|Amusing jokes and witty satire|Brutal, violent prison drama|Quirky and endearing relationships",Action|Drama|Comedy
1007115,Coffin Joe terrorizes a small peasant community in his search for the perfect woman to bear him a child.,"Horror, the undead and monster classics|Intense violence and sexual transgression|Terrifying, haunted, and supernatural horror|Creepy, chilling, and terrifying horror|Graphic violence and brutal revenge|Gory, gruesome, and slasher horror|Gothic and eerie haunting horror",Thriller|Horror
1003799,A teenager finds herself transported to a deep forest setting where a battle between the forces of good and the forces of evil is taking place. She bands together with a rag-tag group characters in order to save their world—and ours.,"Epic heroes|Crude humor and satire|Kids' animated fun and adventure|Fantasy adventure, heroism, and swordplay|Fairy-tale fantasy and enchanted magic|Superheroes in action-packed battles with villains|Adorable animals and heartwarming families",Animation|Adventure|Family|Fantasy
1048376,"Not until three years after the death of her husband Jolly, Kay dares to move back into their former home, persuaded by her new fiancée Rupert. But soon her worst expectations come true, when not only her old memories haunt her, but also Jolly's ghost, who doesn't approve of her new mate. Invisible to anyone but Kay, he tries to prevent the wedding.","Relationship comedy|Crude humor and satire|Charming romances and delightful chemistry|Laugh-out-loud relationship entanglements|Quirky and endearing relationships|Gags, jokes, and slapstick humor|Catchy songs and hilarious musical comedy",Fantasy|Romance|Comedy
1016698,"Sam is a teenage royal rebel, second in line to the throne of the kingdom of Illyria. Just as her disinterest in the royal way of life is at an all-time high, she discovers she has super-human abilities and is invited to join a secret society of similar extraordinary second-born royals charged with keeping the world safe.",Underdogs and coming of age|Teen school antics and laughter,Action|Adventure|Fantasy|Comedy
1007945,"The summer before college, Auden meets the mysterious Eli, a fellow insomniac. While the seaside town of Colby sleeps, the two embark on nightly quests to help Auden experience the fun, carefree teen life she never knew she wanted.",Moving relationship stories|Emotional teen coming-of-age stories|Touching and sentimental family stories|Teen school antics and laughter|Emotional and touching family dramas|Teen friendship and coming-of-age,Romance|Drama
1010854,"The story revolves around a blind boy named Mohammed who is released from his special school in Tehran for summer vacation. His father, shamed and burdened by Mohammed's blindness, arrives late to pick him up and then tries to convince the headmaster to keep Mohammed over the summer. The headmaster refuses, so Mohammed's father eventually takes him home.",Moving relationship stories|Emotional and touching family dramas|Touching and sentimental family stories|Heartbreaking and moving family drama|Powerful stories of heartbreak and suffering|Tragic sadness and captivating beauty,Drama|Family
1044202,"François van Heerden, a mid-40s Afrikaans family man, has become devoid of any care or concern for his own measure of happiness, and so convinced of his ill-fated existence, that he is wholly unprepared when a chance encounter unravels his clean, controlled life.",Intense violence and sexual transgression|Graphic violence and brutal revenge|Challenging or sexual themes & twists|Emotional LGBTQ relationships|Erotic relationships and desire,Drama|Thriller
1016040,"After witnessing a grotesque murder at a party in her new town, a teenager starts having strange visions and bizarre desires.","Horror, the undead and monster classics|Sci-fi horror, creatures, and aliens|Survival horror and zombie carnage|Twisted dark psychological thriller|Bloody vampire horror|Suspenseful crime thrillers",Horror|Mystery|Thriller
1022495,"Pat Riley, an obnoxious busybody of indeterminable sex, meets and falls in love with Chris, a sensitive, caring person also of indeterminable sex. Their relationship suffers because Pat's a lout, and cannot decide on a direction for their life. Meanwhile, Pat's neighbor Kyle falls further and further into obsession with Pat, fascinated by their indeterminate sexuality.","Crude humor and satire|Funny jokes and crude humor|Gags, jokes, and slapstick humor|Teen school antics and laughter|Amusing jokes and witty satire|Spooky, scary comedy",Comedy
1004808,"Five bored, occasionally high and always ineffective Vermont state troopers must prove their worth to the governor or lose their jobs. After stumbling on a drug ring, they plan to make a bust, but a rival police force is out to steal the glory.","Crude humor and satire|Funny jokes and crude humor|Gags, jokes, and slapstick humor|Amusing jokes and witty satire|Teen school antics and laughter|Catchy songs and hilarious musical comedy",Crime|Comedy|Mystery
1001912,"Furious that her late father only willed her his gloomy-looking mansion rather than his millions, Carrigan Crittenden is ready to burn the place to the ground when she discovers a map to a treasure hidden in the house. But when she enters the rickety mansion to seek her claim, she is frightened away by a wicked wave of ghosts. Determined to get her hands on this hidden fortune, she hires afterlife therapist Dr. James Harvey to exorcise the ghosts from the mansion. Harvey and his daughter Kat move in, and soon Kat meets Casper, the ghost of a young boy who's ""the friendliest ghost you know."" But not so friendly are Casper's uncles--Stretch, Fatso and Stinkie--who are determined to drive all ""fleshies"" away.","Crude humor and satire|Moving relationship stories|Kids' animated fun and adventure|Touching and sentimental family stories|Quirky and endearing relationships|Spooky, scary comedy|Emotional and touching family dramas",Fantasy|Comedy|Family
1028378,A retired sports teacher transforms a bunch of teenage slum goons into disciplined football players against all odds.,Moving relationship stories|Bollywood emotional dramas,Drama
1030916,A woman inherits a rent-controlled apartment and is terrorized by a neighbor.,"Horror, the undead and monster classics|Terrifying, haunted, and supernatural horror|Twisted dark psychological thriller|Gothic and eerie haunting horror|Creepy, chilling, and terrifying horror",Mystery|Thriller|Horror
1027942,"When heiress Jean Courtland attempts suicide, her fiancée Elliott Carson probes her relationship with John Triton. In flashback, we see how stage mentalist Triton starts having terrifying flashes of true precognition. Now years later, he desperately tries to prevent tragedies in the Courtland family.","Thrillers and murder mysteries|Terrifying, haunted, and supernatural horror|Noir and dark crime dramas|Suspenseful crime thrillers",Mystery|Thriller
1027152,It's the year 2707. Earth's natural resources have all but been exhausted by mankind. Battles rage for the remainder between the competing Corporations. During one such battle the seal is broken and awakens an ancient and deadly machine that was once defeated thousands of years ago. The order that awaited its return must now lead a small group of soldiers to destroy it once and for all.,"Monsters, aliens, sci-fi and the apocalypse|Epic heroes|War and historical adventure|Action-packed space and alien sagas|Thought-provoking sci-fi action and future technology|Imaginative space odysseys and alien encounters|Superheroes in action-packed battles with villains|Fantasy adventure, heroism, and swordplay",Action|Adventure|Science Fiction|Horror
1015662,God and Satan are on a train discussing the fate of three individuals. The stories of the people in question are told in a trio of very strange vignettes. One involves an insane asylum with some very interesting treatment plans. Another involves a 'death club'. The final story shows us the adventures of a server of Satan.,"Song and dance|Gory, gruesome, and slasher horror|Gothic and eerie haunting horror|Graphic violence and brutal revenge|Twisted dark psychological thriller|Creepy, chilling, and terrifying horror",Horror
1005562,"When Kanako, a model daughter and a brilliant student, disappears, her mother asks her ex-husband, a violent former policeman, to find her. As his investigation progresses, his idealized image of Kanako cracks: the girl hides a dark life that her father can not even imagine.","Intense violence and sexual transgression|Crime, drugs and gangsters|Graphic violence and brutal revenge|Challenging or sexual themes & twists|Twisted dark psychological thriller|Gripping, intense violent crime|Gritty crime and ruthless gangsters",Crime|Mystery|Thriller
1041161,A group of social media experts are hired to help an old family business to strive. But they soon find themselves stuck on a tiny island in a lake in which an ancient Swedish witch is said to live.,"Horror, the undead and monster classics|Twisted dark psychological thriller",Horror
1024513,"After young Robert Graham commits a murder while drunk and defending his girlfriend, he is prosecuted by ambitious Mark Brady and sentenced to 10 years. Six years later, Brady becomes the prison warden and offers the beleaguered Robert a job as his chauffeur. Robert cleans up his act, but, on the eve of his pardon, his cellmate drags him back into the world of violence, and he faces a difficult choice that could return him to prison.","Crime, drugs and gangsters|Brutal, violent prison drama",Drama|Crime
1053465,"Set against the pulsating backdrop of rustic North India, Love Hostel traces the volatile journey of star-crossed lovers, being hunted by a ruthless mercenary on the orders of the area's MLA, who also happens to be the girl's grandmother.","Crime, drugs and gangsters|Bollywood emotional dramas",Crime|Thriller|Romance
1042600,A beautiful but unscrupulous female performer manipulates all the men in her life in order to achieve her aims.,Thrillers and murder mysteries|Noir and dark crime dramas|Passion and romance,Drama|Mystery|Crime
1009681,"Marion and Jack try to rekindle their relationship with a visit to Paris, home of Marion's parents — and several of her ex-boyfriends.","Relationship comedy|Crude humor and satire|Laugh-out-loud relationship entanglements|Quirky and endearing relationships|Charming romances and delightful chemistry|Funny jokes and crude humor|Gags, jokes, and slapstick humor",Comedy|Romance
1051214,"Aliens in human disguise commandeer a rural airport during a snowstorm. To survive, the people trapped inside must determine which of their own is not of this Earth.","Monsters, aliens, sci-fi and the apocalypse|Sci-fi horror, creatures, and aliens",Thriller|Science Fiction|Horror|TV Movie
1027150,"A genius mathematician doubles up as a hit man, assassinating people opposing a ruthless corporate behemoth. While he manages to stay ahead of the Interpol and the psychotic head of the corporation, who are after him, can he evade the mysterious hacker who is keen to unmask him?",Thrillers and murder mysteries|Bollywood emotional dramas,Action|Thriller
1069333,Adapted from Len Deighton’s 1978 alternate history novel. A British detective investigates a murder in German-occupied Britain during World War II.,Thrillers and murder mysteries|Intriguing and suspenseful murder mysteries|Nazis and World War II|Suspenseful crime thrillers|Noir and dark crime dramas|Bravery in War,Drama
1026434,A family intervention goes horrifically awry within the snowy confines of an isolated lake house.,"Horror, the undead and monster classics|Sci-fi horror, creatures, and aliens|Twisted dark psychological thriller|Gothic and eerie haunting horror|Terrifying, haunted, and supernatural horror|Chilling experiments and classic monster horror",Mystery|Horror|Thriller
1007449,"Cheng is a young Chinese mainlander who moves in with his expatriate cousins to work at an ice factory in Thailand. He does this with a family promise never to get involved in any fights. However, when members of his family begin disappearing after meeting the management of the factory, the resulting mystery and pressures force him to break that vow and take on the villainy of the Big Boss.","Epic heroes|Intense combat and martial arts|Violent action, guns, and crime|Superheroes in action-packed battles with villains|Explosive and action-packed heroes vs. villains|Action comedy and silly heroics",Action
1003241,A young widow discovers that her late husband has left her 10 messages intended to help ease her pain and start a new life.,Relationship comedy|Moving relationship stories|Crude humor and satire|Touching and sentimental family stories|Laugh-out-loud relationship entanglements|Quirky and endearing relationships|Charming romances and delightful chemistry|Powerful stories of heartbreak and suffering,Romance|Drama
1039141,"Claire, a brilliant student, seeks answers to the meaning of life in the calm of her biology laboratory. One day, she meets a mysterious young man, Jack, at the cinema, and is intrigued by his style, assurance and audacity. Apart from his artistic activities, Jack has a regular scam going, ripping off foreign businessmen with his loyal mate Charlie and two actresses. But his tough guy exterior conceals a secret passion for old books, and he dreams of writing a novel one day. Jack falls hard for Claire's purity and curiosity. An unusual romance develops between them. But Jack is scared of their growing intimacy and rejects Claire, withdrawing into his shell. Abandoned and confused, Claire gradually begins to neglect her studies and embarks on a spiraling course of self-destruction, whilst Jack, who tries to ignore her, concentrates on his criminal activities. However, a sharp detective, named Linda Fox, is following his dodgy tracks.",Moving relationship stories|Captivating relationships and charming romance|Passion and romance|Emotional teen coming-of-age stories|Charming romances and delightful chemistry|Emotional LGBTQ relationships,Drama|Crime|Romance
1022154,"In the late 18th century, two newlyweds move into the stately mansion of husband Charles Fengriffen. The bride, Catherine, falls victim to a curse placed by a wronged servant on the Fengriffen family and all its descendants.","Horror, the undead and monster classics|Terrifying, haunted, and supernatural horror|Gothic and eerie haunting horror|Creepy, chilling, and terrifying horror|Chilling experiments and classic monster horror|Gory, gruesome, and slasher horror",Horror
1034278,A documentary on seniors at a high school in a small Indiana town and their various cliques.,Underdogs and coming of age|Emotional teen coming-of-age stories|Teen school antics and laughter|Student coming-of-age challenges,Documentary
1013540,A hard-luck limo driver struggling to go straight and pay off a debt to his bookie takes on a job with a crazed passenger whose sought-after ledger implicates some seriously dangerous criminals.,"Crude humor and satire|Gags, jokes, and slapstick humor|Funny jokes and crude humor|Laugh-out-loud relationship entanglements|Amusing jokes and witty satire|Action comedy and silly heroics",Action|Thriller|Comedy
1062860,"It's Tulsa, Oklahoma at the start of the oil boom and Cherokee Lansing's rancher father is killed in a fight with the Tanner Oil Company. Cherokee plans revenge by bringing in her own wells with the help of oil expert Brad Brady and childhood friend Jim Redbird. When the oil and the money start gushing in, both Brad and Jim want to protect the land but Cherokee has different ideas. What started out as revenge for her father's death has turned into an obsession for wealth and power.",Song and dance|Enduring stories of family and marital drama,Drama
1008873,"A fictionalized account of the last days of Edgar Allan Poe's life, in which the poet is in pursuit of a serial killer whose murders mirror those in the writer's stories.","Thrillers and murder mysteries|Intriguing and suspenseful murder mysteries|Suspenseful crime thrillers|Twisted dark psychological thriller|Gory, gruesome, and slasher horror|Noir and dark crime dramas",Thriller|Horror|Crime|Mystery
1109556,"Tiku Weds Sheru is a romantic comedy about two quirky characters who dream of becoming film stars. While their romance blooms, they get caught between the chaos of the underworld and drugs, and face one tragedy after the other. Will their relationship survive the odds thrown at them?",Relationship comedy|Bollywood emotional dramas,Comedy|Family|Drama
1018970,"A pair of recently married gay men are threatened by one of the partners' brother, a religious fanatic who plots to murder them after being ostracized by his church.","Faith and religion|Faith and spiritual journeys|Religious faith, sin, and forgiveness|Funny jokes and crude humor",Drama|Thriller|Romance
1063920,A college freshman is killed during a fraternity prank and is resurrected as a demonic scarecrow,"Horror, the undead and monster classics|Gory, gruesome, and slasher horror",Drama|Horror|Action
1042612,An ex-con uses his street smarts to become a successful photojournalist.,"Crime, drugs and gangsters|Gritty crime and ruthless gangsters|Brutal, violent prison drama",Drama|Action|Crime
1019673,"This year Christmas with the Whitfields promises to be one they will never forget. All the siblings have come home for the first time in years and they've brought plenty of baggage with them. As the Christmas tree is trimmed and the lights are hung, secrets are revealed and family bonds are tested. As their lives converge, they join together and help each other discover the true meaning of family.",Crude humor and satire|Quirky and endearing relationships|Emotional and touching family dramas|Touching and sentimental family stories|Heartbreaking and moving family drama|Funny jokes and crude humor,Comedy|Romance|Drama
1019898,An old traditional family and a modern family battle over land in a small English village.,Thrillers and murder mysteries|Enduring stories of family and marital drama,Drama
1022303,"While visiting her sister in Paris, a young woman finds romance and learns her brother-in-law is a philanderer.",Relationship comedy|Crude humor and satire|Enduring stories of family and marital drama|Charming romances and delightful chemistry|Laugh-out-loud relationship entanglements|Passion and romance|Quirky and endearing relationships,Romance|Comedy|Drama
1003750,Life for the residents of a tower block begins to run out of control.,"Intense violence and sexual transgression|Humanity and the world around us|Challenging or sexual themes & twists|Dreamlike, quirky, and surreal storytelling|Twisted dark psychological thriller|Graphic violence and brutal revenge|Surreal and thought-provoking visions of life and death",Drama
1010723,"Homeless and on the run from a military court martial, a damaged ex-special forces soldier navigating London's criminal underworld seizes an opportunity to assume another man's identity, transforming into an avenging angel in the process.","Crime, drugs and gangsters|Violent action, guns, and crime|Gritty crime and ruthless gangsters|Violent crime and drugs|Intense combat and martial arts|Explosive and action-packed heroes vs. villains",Action|Thriller
1049140,A well known Parisian inspector becomes involved in an investigation while on holiday.,Thrillers and murder mysteries|Suspenseful crime thrillers|Intriguing and suspenseful murder mysteries|Noir and dark crime dramas|Captivating relationships and charming romance|Twisted dark psychological thriller,Drama|Crime
1034347,"In a newly independent India, a studio boss, his movie-star wife, a trusted aide, a nautch girl and a refugee will have their paths cross in their pursuit of stardom and riches.",Song and dance|Bollywood emotional dramas,Drama
1030320,"After a singer loses his job at a coffee shop, he finds employment at a struggling carnival, but his attempted romance with a teenager leads to friction with her father.",Song and dance|Dazzling vocal performances and musicals,Music|Romance
1004315,"Freshly graduated from high school, Ana receives a full scholarship to Columbia University. Her very traditional, old-world parents feel that now is the time for Ana to help provide for the family, not the time for college.",Underdogs and coming of age|Heartbreaking and moving family drama|Student coming-of-age challenges|Touching and sentimental family stories|Emotional and touching family dramas|Emotional teen coming-of-age stories,Drama|Comedy
1003880,"Following the murder of his fiancée, Mitch Rapp trains under the instruction of Cold War veteran Stan Hurley. The pair then is enlisted to investigate a wave of apparently random attacks on military and civilian targets.","High speed and special ops|Epic heroes|Explosive and action-packed heroes vs. villains|Exciting spy thrillers with tense intrigue|Violent action, guns, and crime|Intense political and terrorist thrillers|Intense combat and martial arts",Thriller|Action
